aggregatable,autoNumber,byteLength,calculated,calculatedFormula,cascadeDelete,caseSensitive,compoundFieldName,controllerName,createable,custom,defaultValue,defaultValueFormula,defaultedOnCreate,dependentPicklist,deprecatedAndHidden,digits,displayLocationInDecimal,encrypted,externalId,extraTypeInfo,filterable,filteredLookupInfo,groupable,highScaleNumber,htmlFormatted,idLookup,inlineHelpText,label,length,mask,maskType,name,nameField,namePointing,nillable,permissionable,picklistValues,polymorphicForeignKey,precision,queryByDistance,referenceTargetField,referenceTo,relationshipName,relationshipOrder,restrictedDelete,restrictedPicklist,scale,searchPrefilterable,soapType,sortable,type,unique,updateable,writeRequiresMasterRead
False,False,18,False,,False,False,,,False,False,,,True,False,False,0,False,False,False,,True,,True,False,False,True,,Custom Metadata Record ID,18,,,Id,False,False,False,False,[],False,0,False,,[],,,False,False,0,False,tns:ID,True,id,False,False,False
False,False,120,False,,False,False,,,False,False,,,True,False,False,0,False,False,False,,True,,True,False,False,False,,Custom Metadata Record Name,40,,,DeveloperName,True,False,False,False,[],False,0,False,,[],,,False,False,0,False,xsd:string,True,string,False,False,False
False,False,120,False,,False,False,,,False,False,,,False,False,False,0,False,False,False,,True,,True,False,False,False,,Label,40,,,MasterLabel,False,False,False,False,[],False,0,False,,[],,,False,False,0,False,xsd:string,True,string,False,False,False
False,False,120,False,,False,False,,,False,False,,,False,False,False,0,False,False,False,,True,,True,False,False,False,,Master Language,40,,,Language,False,False,False,False,"[OrderedDict([('active', True), ('defaultValue', False), ('label', 'English'), ('validFor', None), ('value', 'en_US')]), OrderedDict([('active', True), ('defaultValue', False), ('label', 'German'), ('validFor', None), ('value', 'de')]), OrderedDict([('active', True), ('defaultValue', False), ('label', 'Spanish'), ('validFor', None), ('value', 'es')]), OrderedDict([('active', True), ('defaultValue', False), ('label', 'French'), ('validFor', None), ('value', 'fr')]), OrderedDict([('active', True), ('defaultValue', False), ('label', 'Italian'), ('validFor', None), ('value', 'it')]), OrderedDict([('active', True), ('defaultValue', False), ('label', 'Japanese'), ('validFor', None), ('value', 'ja')]), OrderedDict([('active', True), ('defaultValue', False), ('label', 'Swedish'), ('validFor', None), ('value', 'sv')]), OrderedDict([('active', True), ('defaultValue', False), ('label', 'Korean'), ('validFor', None), ('value', 'ko')]), OrderedDict([('active', True), ('defaultValue', False), ('label', 'Chinese (Traditional)'), ('validFor', None), ('value', 'zh_TW')]), OrderedDict([('active', True), ('defaultValue', False), ('label', 'Chinese (Simplified)'), ('validFor', None), ('value', 'zh_CN')]), OrderedDict([('active', True), ('defaultValue', False), ('label', 'Portuguese (Brazil)'), ('validFor', None), ('value', 'pt_BR')]), OrderedDict([('active', True), ('defaultValue', False), ('label', 'Dutch'), ('validFor', None), ('value', 'nl_NL')]), OrderedDict([('active', True), ('defaultValue', False), ('label', 'Danish'), ('validFor', None), ('value', 'da')]), OrderedDict([('active', True), ('defaultValue', False), ('label', 'Thai'), ('validFor', None), ('value', 'th')]), OrderedDict([('active', True), ('defaultValue', False), ('label', 'Finnish'), ('validFor', None), ('value', 'fi')]), OrderedDict([('active', True), ('defaultValue', False), ('label', 'Russian'), ('validFor', None), ('value', 'ru')]), OrderedDict([('active', True), ('defaultValue', False), ('label', 'Spanish (Mexico)'), ('validFor', None), ('value', 'es_MX')]), OrderedDict([('active', True), ('defaultValue', False), ('label', 'Norwegian'), ('validFor', None), ('value', 'no')])]",False,0,False,,[],,,False,True,0,False,xsd:string,True,picklist,False,False,False
False,False,45,False,,False,False,,,False,False,,,False,False,False,0,False,False,False,,True,,True,False,False,False,,Namespace Prefix,15,,,NamespacePrefix,False,False,True,False,[],False,0,False,,[],,,False,False,0,False,xsd:string,True,string,False,False,False
False,False,120,False,,False,False,,,False,False,,,False,False,False,0,False,False,False,,True,,True,False,False,False,,Label,40,,,Label,False,False,True,False,[],False,0,False,,[],,,False,False,0,False,xsd:string,True,string,False,False,False
False,False,210,False,,False,False,,,False,False,,,False,False,False,0,False,False,False,,True,,True,False,False,False,,Qualified API Name,70,,,QualifiedApiName,False,False,True,False,[],False,0,False,,[],,,False,False,0,False,xsd:string,True,string,False,False,False
False,False,0,False,,False,False,,,False,True,False,,True,False,False,0,False,False,False,,True,,True,False,False,False,For Realtime rollups can only be set when the Child Apex Trigger has been deployed.,Active,0,,,dlrs__Active__c,False,False,False,False,[],False,0,False,,[],,,False,False,0,False,xsd:boolean,True,boolean,False,False,False
False,False,0,False,,False,False,,,False,True,False,,True,False,False,0,False,False,False,,True,,True,False,False,False,Includes child records that have been archived by the system and/or placed in the recycle bin.,Aggregate All Rows,0,,,dlrs__AggregateAllRows__c,False,False,False,False,[],False,0,False,,[],,,False,False,0,False,xsd:boolean,True,boolean,False,False,False
False,False,96,False,,False,False,,,False,True,,,False,False,False,0,False,False,False,,True,,True,False,False,False,Rollup operation.,Aggregate Operation,32,,,dlrs__AggregateOperation__c,False,False,True,False,[],False,0,False,,[],,,False,False,0,False,xsd:string,True,string,False,False,False
False,False,240,False,,False,False,,,False,True,,,False,False,False,0,False,False,False,,True,,True,False,False,False,"API name of the field that will store the result of the rollup on the Parent Object, e.g. AnnualRevenue",Aggregate Result Field,80,,,dlrs__AggregateResultField__c,False,False,False,False,[],False,0,False,,[],,,False,False,0,False,xsd:string,True,string,False,False,False
False,False,96,False,,False,False,,,False,True,,,False,False,False,0,False,False,False,,True,,True,False,False,False,Realtime and Schedule modes require an Apex Trigger to be deployed for the Child Object. Click Manage Child Trigger button to deploy.,Calculation Mode,32,,,dlrs__CalculationMode__c,False,False,True,False,[],False,0,False,,[],,,False,False,0,False,xsd:string,True,string,False,False,False
False,False,96,False,,False,False,,,False,True,,,False,False,False,0,False,False,False,,True,,True,False,False,False,Determines if the Sharing Rules defined on the Child Object are considered when calculating the rollup. Default is User.,Calculation Sharing Mode,32,,,dlrs__CalculationSharingMode__c,False,False,True,False,[],False,0,False,,[],,,False,False,0,False,xsd:string,True,string,False,False,False
False,False,240,False,,False,False,,,False,True,,,False,False,False,0,False,False,False,,True,,True,False,False,False,"API name of the Child Object, e.g. Opportunity",Child Object,80,,,dlrs__ChildObject__c,False,False,False,False,[],False,0,False,,[],,,False,False,0,False,xsd:string,True,string,False,False,False
False,False,96,False,,False,False,,,False,True,,,False,False,False,0,False,False,False,,True,,True,False,False,False,"Enter the character or characters to delimit values in the Field to Aggregate when rolling up text values into the Aggregate Result Field, enter BR() for new line. Only applies when using Concatenate operation.",Concatenate Delimiter,32,,,dlrs__ConcatenateDelimiter__c,False,False,True,False,[],False,0,False,,[],,,False,False,0,False,xsd:string,True,string,False,False,False
False,False,765,False,,False,False,,,False,True,,,False,False,False,0,False,False,False,plaintextarea,True,,True,False,False,False,,Description,255,,,dlrs__Description__c,False,False,True,False,[],False,0,False,,[],,,False,False,0,False,xsd:string,True,textarea,False,False,False
False,False,240,False,,False,False,,,False,True,,,False,False,False,0,False,False,False,,True,,True,False,False,False,"API name of the field on the Child Object that contains the value to rollup, e.g. Amount",Field to Aggregate,80,,,dlrs__FieldToAggregate__c,False,False,False,False,[],False,0,False,,[],,,False,False,0,False,xsd:string,True,string,False,False,False
False,False,765,False,,False,False,,,False,True,,,False,False,False,0,False,False,False,,True,,True,False,False,False,"Only applicable when using the Concatenate, Concatenate Distinct, Last and First aggregate operations. Supports multiple fields (comma separated) with optional ASC/DESC and/or NULLS FIRST/LAST.",Field to Order By,255,,,dlrs__FieldToOrderBy__c,False,False,True,False,[],False,0,False,,[],,,False,False,0,False,xsd:string,True,string,False,False,False
False,False,240,False,,False,False,,,False,True,,,False,False,False,0,False,False,False,,True,,True,False,False,False,"API name of the Parent Object, e.g. Account",Parent Object,80,,,dlrs__ParentObject__c,False,False,False,False,[],False,0,False,,[],,,False,False,0,False,xsd:string,True,string,False,False,False
False,False,765,False,,False,False,,,False,True,,,False,False,False,0,False,False,False,plaintextarea,True,,True,False,False,False,"If you have specified a relationship criteria, you must confirm the fields referenced by it here on separate lines, for example for criteria StageName = 'Won' list StageName in this field. You do not need to specify the Field to Aggregate field however.",Relationship Criteria Fields,255,,,dlrs__RelationshipCriteriaFields__c,False,False,True,False,[],False,0,False,,[],,,False,False,0,False,xsd:string,True,textarea,False,False,False
False,False,765,False,,False,False,,,False,True,,,False,False,False,0,False,False,False,,True,,True,False,False,False,"SOQL WHERE clause applied when querying Child Object records, e.g. Amount > 200",Relationship Criteria,255,,,dlrs__RelationshipCriteria__c,False,False,True,False,[],False,0,False,,[],,,False,False,0,False,xsd:string,True,string,False,False,False
False,False,240,False,,False,False,,,False,True,,,False,False,False,0,False,False,False,,True,,True,False,False,False,"API name of the Lookup field on the Child Object relating to the Parent Object, e.g. AccountId",Relationship Field,80,,,dlrs__RelationshipField__c,False,False,False,False,[],False,0,False,,[],,,False,False,0,False,xsd:string,True,string,False,False,False
False,False,0,False,,False,False,,,False,True,,,False,False,False,0,False,False,False,,True,,False,False,False,False,Limits the number of rows used in the rollup. Applies only to the Last and Concatenate operators.,Row Limit,0,,,dlrs__RowLimit__c,False,False,True,False,[],False,5,False,,[],,,False,False,0,False,xsd:double,True,double,False,False,False
False,False,393216,False,,False,False,,,False,True,,,False,False,False,0,False,False,False,plaintextarea,False,,False,False,False,False,This tool utilises a dynamically generated Apex Trigger and by default a generated Apex Test. Use this field if instructed by a developer to replace the generated test code. See Wiki on GitHub.,Test Code (Child Object),131072,,,dlrs__TestCode2__c,False,False,True,False,[],False,0,False,,[],,,False,False,0,False,xsd:string,False,textarea,False,False,False
False,False,393216,False,,False,False,,,False,True,,,False,False,False,0,False,False,False,plaintextarea,False,,False,False,False,False,"This tool utilises a dynamically generated Apex Trigger and by default a generated Apex Test. Use this field if instructed by a developer to replace the generated test code. See Wiki on GitHub. May not be required, observe Manage Child Trigger page.",Test Code (Parent Object),131072,,,dlrs__TestCodeParent__c,False,False,True,False,[],False,0,False,,[],,,False,False,0,False,xsd:string,False,textarea,False,False,False
False,False,0,False,,False,False,,,False,True,False,,True,False,False,0,False,False,False,,True,,True,False,False,False,Only use this option as a last resort to get the generated test or custom test code working. It is generally considered bad practice to make your test dependent on org data. Always try to create test data in the test code if possible.,Test Code See All Data,0,,,dlrs__TestCodeSeeAllData__c,False,False,False,False,[],False,0,False,,[],,,False,False,0,False,xsd:boolean,True,boolean,False,False,False
False,False,765,False,,False,False,,,False,True,,,False,False,False,0,False,False,False,plaintextarea,True,,True,False,False,False,This tool utilises a dynamically generated Apex Trigger and by default a generated Apex Test. Use this field if instructed by a developer to replace the generated test code. See Wiki on GitHub.,Test Code (Deprecated),255,,,dlrs__TestCode__c,False,False,True,False,[],False,0,False,,[],,,False,False,0,False,xsd:string,True,textarea,False,False,False
